[
  {
    "@context": [
      "https://w3id.org/traceability/v1"
    ],
    "type": "Observation",
    "property": {
      "type": "MechanicalProperty",
      "identifier": "ISO 180",
      "name": "Izod Impact Strength Test",
      "description": "ISO 180 defines the method used for pendulums to determine the impact resistance of a plastic specimen when supported in a cantilever configuration. Test results are used to evaluate the resilience of materials, typically plastics."
    },
    "measurement": {
      "type": "MeasuredValue",
      "value": "22.493",
      "unitCode": "B13"
    }
  },
  {
    "@context": [
      "https://w3id.org/traceability/v1"
    ],
    "type": "Observation",
    "property": {
      "type": "MechanicalProperty",
      "identifier": "ISO 180",
      "name": "Izod Impact Strength Test",
      "description": "ISO 180 defines the method used for pendulums to determine the impact resistance of a plastic specimen when supported in a cantilever configuration. Test results are used to evaluate the resilience of materials, typically plastics."
    },
    "measurement": {
      "type": "MeasuredValue",
      "value": "56.603",
      "unitCode": "B13"
    }
  },
  {
    "@context": [
      "https://w3id.org/traceability/v1"
    ],
    "type": "Observation",
    "property": {
      "type": "MechanicalProperty",
      "identifier": "ISO 1352",
      "name": "Torque-controlled fatigue testing",
      "description": "ISO 1352:2011 specifies the conditions for performing torsional, constant-amplitude, nominally elastic stress fatigue tests on metallic specimens without deliberately introducing stress concentrations. The tests are carried out at ambient temperature (ideally at between 10 °C and 35 °C) in air by applying a pure couple to the specimen about its longitudinal axis."
    },
    "measurement": {
      "type": "MeasuredValue",
      "value": "00.00",
      "unitCode": "UNKNOWN"
    }
  }
]